{
  "schema_version": "1.0",
  "record_id": "EX-M2-ACTIVITY-RETENTION-001",
  "kind": "activity_retention",
  "units": "fraction",
  "replicates": [
    {"value": 0.68, "std": 0.03, "flag": "", "notes": "Static IgG uptake normalized to soluble Protein A control"},
    {"value": 0.71, "std": 0.03, "flag": "", "notes": "Static IgG uptake normalized to soluble Protein A control"},
    {"value": 0.69, "std": 0.03, "flag": "", "notes": "Static IgG uptake normalized to soluble Protein A control"}
  ],
  "process_conditions": {
    "assay_method": "static_IgG_binding",
    "buffer_pH": 7.4,
    "temperature_C": 25.0,
    "salt_concentration_M": 0.15,
    "target_molecule": "IgG",
    "equilibrium_contact_time_h": 2.0,
    "ligand_lot": "example_lot"
  },
  "sample_id": "example_media_lot_A",
  "instrument": "plate_reader_uv280_example",
  "operator": "example",
  "notebook_ref": "EXAMPLE-LN-M2-002",
  "timestamp_utc": "2026-04-25T00:00:00+00:00",
  "target_module": "M2",
  "notes": "Template only; replace with real assay records before calibration."
}
